date,favorite_count,retweet_count,text
2018-04-09 01:33:01,0,99,"RT @FoxNews: .@RepDeSantis on suspected Syria chemical attack: ""There's not an appetite to have a [ground war] in that region...There's not…"
2018-04-07 23:08:52,26,8,I enjoyed speaking to the Florida Federation of Republican Women at their Spring Conference in Ft. Myers!… https://t.co/6Jq4MabUJw
2018-04-07 23:03:34,32,9,It was great to join the Collier for Trump Club for their meeting in Naples! Thank you for having me! #sayfie https://t.co/HfLYxR8ZnR
2018-04-05 19:18:23,24,11,Congratulations to Clearwater Beach for being named the best beach in the whole country by @TripAdvisor Travelers’… https://t.co/PCbCalLwSp
2018-04-04 15:07:52,49,19,"As a veteran, I’m incredibly proud Florida ranks #1 for military-friendliness. Let’s keep that title! Thanks… https://t.co/cQuzFV6Idv"
2018-04-04 00:12:45,45,10,Florida keeps attracting new businesses and providing an ideal environment for current businesses to expand. Conser… https://t.co/Axnk3tgIza
2018-04-01 13:01:27,151,35,"Christ is risen, He is risen indeed. Happy Easter! #EasterSunday https://t.co/rtsi2KBp3F"
2018-03-30 18:42:45,38,5,Many blessings to you and your family this #Passover. https://t.co/JvrB1hb4S8
2018-03-30 13:05:11,41,8,Thankful for God’s love. #GoodFriday https://t.co/yNQWNd3xZP
2018-03-29 23:51:16,34,2,"Happy #OpeningDay! In honor, here’s a #throwbackthursday of my days on the Yale Baseball team. https://t.co/OEjQAB7f6p"
2018-03-29 15:44:55,20,10,First responders risk their lives to protect ours. Florida is bringing down barriers for these brave men and women… https://t.co/t4cyFlt0i6
2018-03-28 19:50:00,72,38,"Today we are celebrating our state marine mammal, the manatee! #ManateeAppreciationDay #LoveFL https://t.co/yvgLsjwoeP"
2018-03-26 22:23:34,4291,424,"Casey and I are blessed to welcome our son Mason Joseph DeSantis. 8lbs, 4oz and very strong!  Both baby and mom are… https://t.co/Jw4ABEp7m7"
2018-03-26 01:59:00,0,186,"RT @FoxNews: .@RonDeSantisFL: ""If you're somebody that's been the secretary of state or you've been White House chief of staff, you should…"
2018-03-25 14:40:51,41,7,Wishing you and your family a blessed Palm Sunday. https://t.co/hngNDPZ2Yy
2018-03-23 13:44:56,0,65,"RT @FoxBusiness: .@RepDeSantis on spending bill: ""I'd like to see the president to veto it."" https://t.co/2WuKPvT5nY"
2018-03-22 23:10:36,20,9,That’s why I continue to push for the passage of the #PAWSAct on the federal level to ensure our veterans can have… https://t.co/vw2wJ7OtjP
2018-03-22 23:10:35,38,12,Thankful to @FlGovScott for recognizing the importance of service dogs for the brave men and women who have served… https://t.co/aypwq9n1fQ
2018-03-21 15:02:48,58,28,I’m honored to have received the title of “Taxpayer Super Hero” from the CCAGW. I believe in ensuring government ac… https://t.co/aDcn50PyJy
2018-03-20 17:12:50,33,11,Incredibly thankful for all the hardworking Floridians in the agriculture industry! Thank you for everything you do… https://t.co/hbEF2j65sA
2018-03-19 14:03:19,29,10,Proud to have been the first elected official in FL to endorse @MarsysLawforFL. Victims of crime deserve enforceabl… https://t.co/9q9S5zMIOn
2018-03-16 22:26:34,20,11,Floridians will always put their money to better use than government bureaucrats! https://t.co/wh8RhUTOmr
2018-03-16 22:26:34,26,14,.@FLGovScott fought for Florida taxpayers by proposing a change to our constitution to make it more difficult for f… https://t.co/f2h65hLYFX
2018-03-15 03:21:25,0,183,"RT @FoxNews: .@RepDeSantis on Gina Haspel nomination for CIA: “I think it was a good pick, and I think she should be confirmed.” @foxnewsni…"
2018-03-14 19:36:05,22,11,"Florida businesses created over 144,000 jobs last year! In total, almost 1.5 million jobs have been created under… https://t.co/mfH7D0JDtU"
2018-03-13 15:35:41,0,148,RT @FoxNews: .@RepDeSantis: “[Mike Pompeo] understands the dangers posed by North Korea.” https://t.co/GZ8aWvSPvb
2018-03-13 00:12:22,61,20,Good to be back where I grew up in Pinellas County with friends! #sayfie https://t.co/laLag1FgKW
2018-03-12 18:30:42,25,11,There’s been an unprecedented amount of pressure brought to bear on the North Korean regime thanks to @POTUS. He is… https://t.co/T1NFRrH60V
2018-03-12 14:00:57,0,30,"RT @FoxBusiness: .@RepDeSantis on PA special election: ""If the Republicans do win it I think Donald Trump will be the big reason why."" http…"
2018-03-10 00:06:19,72,25,Thank you @JudgeJeanine for your support and being a part of our fundraiser in Central Florida to benefit our campa… https://t.co/4wa5F1rZR8
2018-03-09 14:08:29,0,415,"RT @FoxNews: .@RepDesantis: ""@Comey said, 'Oh, we didn't make any decisions on Hillary.' Well this investigation showed they drafted an exo…"
2018-03-08 21:19:31,14,5,.@FLGovScott has championed these efforts in Florida and I want to continue that legacy. #sayfie
2018-03-08 21:19:31,10,5,.@POTUS understands how vital STEM is to the future of American innovation and our economy. Our future depends on w… https://t.co/Xo3vQyaQoc
2018-03-05 18:40:15,420,205,"Ron DeSantis is an Iraq War veteran, a top conservative leader and the ONLY candidate with the support of President… https://t.co/5ZIA2vUvYV"
2018-03-05 14:53:27,74,39,"I’m calling for a second special counsel, someone from outside of the Washington swamp with no allegiance to high r… https://t.co/cViCS1RMrW"
2018-03-03 15:52:45,47,8,"The greatest state in the nation, Florida, became the 27th state on March 3, 1845. Happy 173rd Anniversary to the S… https://t.co/fDPpT8LVzV"
2018-03-01 18:31:21,42,27,"In the wake of Parkland, the goal should be to keep our students safe, bring accountability to the officials and in… https://t.co/JYAizLH6px"
2018-03-01 04:23:17,0,373,"RT @FoxNews: .@RonDeSantisFL on @POTUS, Sessions feud: ""From what we've seen over the last 6 or 7 months, just the scores of people who've…"
2018-02-28 16:05:11,67,26,"It’s been one month since we launched our campaign! Together, we will strengthen our economy, appoint strict consti… https://t.co/lFiEanwmJL"
2018-02-27 16:33:55,27,15,Proud to have worked with @POTUS to create such an optimistic business climate in Florida! According to a recent su… https://t.co/3ZiGDDhp78
2018-02-26 22:14:15,15,6,This is what resilience looks like. Congratulations to the Marjory Stoneman Douglas High School boys ice hockey tea… https://t.co/suv4ZSliCl
2018-02-23 00:29:42,26,8,The American flag stands for one nation under God with liberty and justice for all! We must stand for our national… https://t.co/lRFGVj4E97
2018-02-21 18:22:50,34,16,"Rest In Peace to America’s pastor @BillyGraham, who impacted millions of lives around the world with the good news… https://t.co/c1QinK7jnw"
2018-02-17 15:47:03,42,7,Had breakfast with some great supporters this morning in Naples! https://t.co/WzmHmFsogC
2018-02-14 15:29:33,76,13,"Happy Valentine’s Day to my wonderful wife, Casey. Thank you for blessing me with 8 incredible years of marriage an… https://t.co/cF04k0NUU6"
2018-02-14 01:28:52,0,314,"RT @FoxNews: .@RepDeSantis on ""odd"" Rice email sent on #Trump's Inauguration Day: ""I think Susan Rice has a lot of questions that she's goi…"
2018-02-14 00:19:49,23,5,Tune in to @FoxNews at 8pm. I will be joining @TuckerCarlson to discuss the latest insight on the surveillance by t… https://t.co/GhdIS5fZc2
2018-02-13 21:24:06,30,12,President @RealDonaldTrump’s infrastructure plan to cut red tape and speed up the permit approval process will help… https://t.co/tLkrC8l4v0
2018-02-13 00:49:55,29,11,President @RealDonaldTrump’s tax reform is directly benefiting Florida businesses and taxpayers. It's allowing comp… https://t.co/gdpYApl4S9
2018-02-12 16:35:31,18,5,Join us on @OutnumberedFNC @FoxNews at 12pm today! https://t.co/NMi2rLMHFn
2018-02-09 15:37:00,15,7,"Especially pulling for our hometown heroes from the Sunshine State! LET’S BRING HOME THE GOLD, @TEAMUSA!"
2018-02-09 15:36:01,31,11,Best of luck to our Olympians wearing the Stars and Stripes in the PyeongChang Winter #Olympics! https://t.co/BO9OgcibhV
2018-02-06 21:04:12,23,5,Great to see the @SpaceX Falcon Heavy launching from Florida’s Space Coast! https://t.co/3vOP7q8DEJ
2018-02-06 01:02:09,24,5,"Excited to join @IngrahamAngle tonight at 10pm on @FoxNews! Tune in for insights on the release of the memo, FISA court and more. #Sayfie"
2018-02-06 00:33:55,0,1049,RT @LouDobbs: Deep State Tactics- @RepDeSantis: Clinton associates &amp; Obama leftovers dug up dirt and were feeding information to dossier au…
2018-02-06 00:33:14,0,94,"RT @FoxBusiness: On '@LouDobbs Tonight': @RepDeSantis: ""If [the FBI] knew more than they let on but then didn't disclose it to the court, t…"
2018-02-04 00:51:44,13,2,Join us live at 9:00pm! @SayfieReview https://t.co/cV98pEZ471
2018-02-03 17:12:15,21,3,I’ll be joining @FoxNews at 12:30pm today! Tune in as we discuss the latest from this week. #sayfie
2018-02-02 18:31:59,0,357,"RT @FoxNews: .@RepDeSantis: ""We're in 2018 now and we still don't have evidence of any Trump-Russia campaign collusion."" #MemoDay https://t…"
2018-02-02 18:21:08,0,282,"RT @FoxNews: .@RepDeSantis: ""This whole Russia stuff was, I think, much more wishful thinking on the part of @FBI agents like Peter Strzok,…"
2018-02-02 18:21:05,0,406,"RT @FoxNews: .@RepDeSantis: ""This whole Russia narrative was based off anonymous sources, months and months of leaks from the bureaucrats t…"
2018-02-02 18:21:03,0,372,"RT @FoxNews: .@RepDeSantis: ""It's a confluence of the Democratic Party, the Obama Administration, Fusion GPS, the media."" #MemoDay https://…"
2018-02-02 18:20:59,0,481,"RT @FoxNews: .@RepDeSantis: ""It answers the question about did the @FBI used this Democrat Party-funded dossier to obtain surveillance - an…"
2018-02-02 17:41:38,209,33,Tune in to @FoxNews @OutnumberedOT with @HarrisFaulkner at 1pm. We will be discussing the latest on the House Intel… https://t.co/30rgCmkl8q
2018-01-31 02:59:35,31,18,"Thanks to @POTUS, America is back on track again. #SOTU https://t.co/oXO0bGhD4C"
2018-01-31 02:34:16,27,9,President @RealDonaldTrump’s first year was a huge success! THANK him and tell us what big win you're most excited… https://t.co/P5a6QRDvuX
2018-01-30 20:52:23,50,17,Yesterday we officially launched our campaign for Governor in front of hundreds of conservative supporters in Boca… https://t.co/W6ESAR1Jqf
2018-01-29 17:12:21,230,123,"I’m proud to stand here today as a veteran of our Armed Forces, as a principled conservative leader and with the su… https://t.co/qyNYdRGeqJ"
2018-01-29 17:12:01,65,43,"I’ve fought to clean up Washington by fighting against congressional pay increases and pensions, pushing term limit… https://t.co/Py97owKEO1"
2018-01-29 17:11:38,49,35,The forgotten man and woman is the hard working American taxpayer who wakes up every day without asking government… https://t.co/aro4CC6ieu
2018-01-29 17:09:41,23,11,"As a state surrounded by beautiful beaches and waterways, our environment and our economy depends on protecting the… https://t.co/8DA7MUMxfC"
2018-01-29 17:09:10,28,18,I will fight every single day I bring an end to the opioid crisis that has reached all corners of Florida and the c… https://t.co/7xZpptkNVf
2018-01-29 17:08:16,33,19,"For too long, FL courts have legislated from the bench, harming our constitutional system. As Governor, I will appo… https://t.co/UyZyUqEgZR"
2018-01-29 17:07:46,29,11,"We must prepare students for citizenship with a renewed focus on the founding principles of our country, the Consti… https://t.co/sXOBQDcpHF"
2018-01-29 17:07:30,27,12,"Goal of education should be to equip students, regardless of economic circumstances, with the tools to realize thei… https://t.co/zfQSHJIZyc"
2018-01-29 17:05:52,28,14,"FL cannot afford to go backward and adopt the policies of CA, NY, or IL that punish job creators and drive away inv… https://t.co/aAv8bC4VDx"
2018-01-29 17:05:29,17,6,.@FlGovScott beat the Tallahassee insiders against him and his conservative message in 2010. We can’t allow these s… https://t.co/z4EBPKgm0H
2018-01-29 17:04:43,21,5,.@FlGovScott deserves our thanks for his stewardship of our state. His leadership on our economy and during two con… https://t.co/geLjjVYHlp
2018-01-29 17:04:08,22,6,"By recognizing Jerusalem we as a nation are finally standing with Israel, not trying to undermine Israel! #DeSantisforGovernor"
2018-01-29 17:03:20,33,12,Thank you @POTUS for having faith in me and helping get our country back on track. #DeSantisforGovernor
2018-01-29 17:02:37,37,17,"President Trump has done wonders for America in his first year- Supreme Court, cutting regulations, recognizing Jer… https://t.co/PhA0pxJMfV"
2018-01-29 17:01:32,32,15,I’m running for Governor to provide every Floridian with the opportunity to create a better life for themselves and… https://t.co/afdMLCzBGq
2018-01-29 17:01:11,18,9,"Florida’s economy, education system, and courts are all at stake in this election.  We must keep our state under co… https://t.co/9LQKXxXMsz"
2018-01-29 17:00:14,15,7,Florida is the state of opportunity for families and businesses- we must fight to keep it that way. #DeSantisforGovernor
2018-01-29 16:59:27,46,29,Today we kick off our campaign for Governor.  The fight to keep Florida under conservative leadership starts now! #DeSantisforGovernor
2018-01-29 16:55:56,10,1,@realDonaldTrump has done wonders for America in his first year and I’m honored to have his endorsement for Governor! #DeSantisForGovernor
2018-01-29 16:43:21,27,10,"Casey DeSantis: Ron is a man running for the right reasons, because he is the man with the strength and courage to… https://t.co/aOVlEJBtyv"
2018-01-29 16:29:49,13,6,".@RepJenniffer: Ron DeSantis is the one asking me how can we help Puerto Rico, and that's a true friend.… https://t.co/gMS8fsxUEF"
2018-01-29 16:27:14,0,0,"@RepJenniffer: Ron Desantis is the one asking me how can we help Puerto Rico, and that’s a true friend.… https://t.co/YQHsS2rI4g"
2018-01-29 16:18:06,19,7,HAPPENING NOW: Decorated combat veteran @BrianMastFL opens our campaign kick-off by leading the pledge of allegiance!
2018-01-29 15:18:21,21,11,"Watch the kickoff of our campaign for Governor on Facebook LIVE starting at 11am from Boca Raton, FL! https://t.co/xTrUpkz8ig"
2018-01-25 18:53:04,31,16,"Monday is the big day! We will be kicking off our campaign at the Boca Raton Embassy Suites at 11am with a rally, a… https://t.co/8FSRB7C1KB"
2018-01-23 14:05:21,0,1047,"RT @FoxNews: ""I don't accept the explanation we've been given. I think we need to dig harder."" -@RepDeSantis on revelations that the FBI “f…"
2018-01-23 02:13:46,0,2325,RT @LouDobbs: Department of Corruption- @RepDeSantis: FBI Director Chris Wray must testify under oath about why 5 months of text messages b…
2018-01-22 20:25:30,36,18,"On Monday, January 29th at the Boca Raton Embassy Suites, we will be kicking off our campaign for Governor. It woul… https://t.co/AW6e2XJUJN"
2018-01-21 23:37:53,0,219,RT @foxandfriends: .@RepDeSantis on government shutdown: “We’ve done our job…Senate Democrats are holding up the train” https://t.co/eqSCfo…
2018-01-19 16:06:49,0,1522,RT @DonaldJTrumpJr: Rep. DeSantis wants report on surveillance abuse made public https://t.co/8qwV67rLOf
2018-01-19 01:25:10,58,32,"Join us for our campaign kick-off rally on Monday, January 29th at 11am at the Boca Raton Embassy Suites! RSVP here… https://t.co/MQDTNj5tlQ"
2018-01-18 20:24:24,43,13,"“I can not more enthusiastically endorse and completely support your run, and I really think the people of Florida… https://t.co/uYHZAA3EcT"
2018-01-15 14:39:08,24,5,"Today we honor the life and legacy of a true American hero, Dr. Martin Luther King Jr. His courage and commitment t… https://t.co/xd4zTWpDod"
2018-01-10 16:37:36,37,21,"“I’ve gotten to know Ron DeSantis. He’s a very decent man, a very principled man, a family man with a beautiful fam… https://t.co/P9NW1AMEYz"
2018-01-09 21:23:40,61,31,Today is National Law Enforcement Appreciation Day. I am incredibly thankful for the brave men and women in Florida… https://t.co/DrSkvdP82a
2018-01-08 16:01:39,71,11,Looking forward to it! #sayfie https://t.co/Avr2BHZbxG
2018-01-06 18:58:54,155,43,Pleasure to see a great American today in Orlando.  Thanks to Coach Lou Holtz for the endorsement! https://t.co/J1OW1z5QsL
2018-01-06 17:42:27,77,17,Brought a special guest with me to @FloridaGOP’s annual meeting! https://t.co/DcQYyoRcNP
2018-01-05 11:58:07,1433,801,"Thank you, President @realDonaldTrump, for the support. Let’s build on @FLGovScott’s strong record and make Florida… https://t.co/gB9V95n4hL"
2018-01-05 11:45:21,0,402,RT @FoxNews: .@RepDeSantis to run for governor of Florida @foxandfriends https://t.co/1HElngoWSX
2018-01-01 15:13:22,49,8,"Looking forward to what 2018 will bring! Have a wonderful New Year, from my family to yours. https://t.co/i60j0n5eNJ"
2017-12-30 23:45:45,73,49,"Iran's brutal Islamist regime has ruined the country's economy, supported terrorists, and denied basic rights to it… https://t.co/aVMC4XYBpd"
2017-12-25 13:41:04,57,4,"From my family to yours, Merry Christmas! https://t.co/dlUOfWAiTY"
2017-12-22 19:27:08,174,87,"As an Iraq veteran, I’m especially appreciative of his efforts to support our military and our veterans.  Merry Chr… https://t.co/t1PFd0LtMW"
2017-12-22 19:26:47,208,105,I’m grateful to have @realDonaldTrump’s support &amp; appreciate what he has done — from appointing great judges to rec… https://t.co/4A43ReEZLR
2017-12-21 01:16:38,70,31,Proud that we are delivering on our promise to give American families and small businesses the tax cuts they deserv… https://t.co/c6HeycLEAP
2017-12-20 16:42:38,0,16844,RT @realDonaldTrump: I would like to congratulate @SenateMajLdr on having done a fantastic job both strategically &amp; politically on the pass…
2017-12-09 16:54:00,58,23,It was an honor to appear in Pensacola to introduce @POTUS! https://t.co/x6iudLJSQW #sayfie #flapol
2017-12-09 00:20:41,704,212,Great ride to Pensacola!  Thanks to @realDonaldTrump for the lift! https://t.co/Kb9fkjihnP
2017-12-07 17:37:19,18,4,"The attack on Pearl Harbor was an earth-shattering event that awoke a “sleeping giant,” thrusting the US into WWII… https://t.co/pkE1MQuKYy"
2017-12-06 18:32:32,98,42,I applaud @POTUS for officially recognizing Jerusalem as the capital of Israel &amp; beginning the process of relocatin… https://t.co/AYATBQzZqH
2017-12-01 21:04:26,58,26,Sanctuary cities snub their noses at federal immigration law and care more about protecting violators of law than t… https://t.co/PbpTXcGmcv
2017-12-01 21:03:31,39,20,"This same illegal immigrant, who had been deported five times, was able to kill #KateSteinle only after the sanctua… https://t.co/rzV183GWAK"
2017-12-01 21:02:44,28,10,"Acquitting the illegal immigrant who shot and killed #KateSteinle of murder, involuntary manslaughter, and assault is unconscionable. 1/3"
2017-11-22 19:01:38,66,14,"Happy first birthday to our sweet little girl, Madison. We are incredibly thankful and blessed to have you in our l… https://t.co/E2dDtn1dAx"
2017-11-16 19:58:27,60,24,"It's a no-brainer, we must remove ObamaCare's individual mandate penalty with tax reform. This is a cruel tax that… https://t.co/44IM8QWqrz"
2017-11-11 16:02:21,14,2,Today we say thanks to all of the men and women who put country before self and valiantly served this great nation.… https://t.co/g2qMJs2nMy
2017-11-09 21:21:33,13,9,Thanks to @marklevinshow for the shoutout on his radio program. I appreciate the kudos &amp; was glad that he attended… https://t.co/3teTz23bGm
2017-11-09 15:56:21,15,7,Jerusalem is Israel’s indivisible capital and it’s time we move the American embassy to Jerusalem. Sign if you agre… https://t.co/5zKhtxmJFG
2017-11-02 15:35:04,23,12,I agree with @POTUS. Congress should repeal ObamaCare's harmful and unfair individual mandate tax/penalty as part o… https://t.co/vpx6Ioqjge
2017-10-30 14:43:32,42,27,Uranium One &amp; Russian bribery. Fusion GPS &amp; the Democratic Party. The Comey memos &amp; FBI corruption. We must drain t… https://t.co/d4n9kzH32e
2017-10-25 19:39:21,0,410,RT @foxandfriends: .@RepDeSantis: The confidential informant who wants to testify on the Uranium Deal needs to be released from his non-dis…
2017-10-23 16:04:11,0,3403,"RT @DonaldJTrumpJr: House also probing Obama-era Uranium One deal, DeSantis says https://t.co/Z2xSLSVF2k #FoxNews"
2017-10-19 20:04:46,48,35,We’re working hard to move the #PAWSAct forward to provide service dogs to veterans struggling with PTS — something… https://t.co/t0HUyRGAT3
2017-10-17 17:50:18,30,23,".@JudgeJeanine &amp; I agree that the American people want the IRS, Lynch &amp; Comey held accountable. Get in gear, DOJ! https://t.co/uXzcB6mE9G"
2017-10-13 17:50:57,28,5,Proud to have served in the Navy &amp; currently in the Navy Reserves. Thank you to the brave men &amp; women who selflessl… https://t.co/dyol0p48Ta
2017-10-10 15:42:50,0,35,"RT @OutnumberedFNC: Today, Rep @RonDeSantisFL joins @HARRISFAULKNER @SandraSmithFox @trish_regan &amp; @JessicaTarlov on #Outnumbered  Tune in…"
2017-10-09 13:07:15,52,6,We’re excited that Madison is getting a baby brother! https://t.co/MGOrxUVpJ5
2017-10-02 14:29:27,16,4,My heart goes out to the victims &amp; those affected by the horrific attack in Vegas. Thank you first responders for your bravery. #mandalaybay
2017-09-11 15:45:37,18,6,"Even in the midst of a hurricane, we will never forget 9/11. https://t.co/8cqr5gBzwq"
2017-09-06 15:47:38,8,5,Joined @FoxNews to discuss #HurricaneIrma preparations. Thank you @POTUS &amp; @FlGovScott for your leadership on this. https://t.co/nJnambljim
2017-09-06 13:37:13,6,4,"Please be vigilant and prepare for #HurricaneIrma. If you have not created a hurricane preparedness plan, visit… https://t.co/Y6Jc0MjbaG"
2017-09-03 18:49:52,6,4,Joined @FoxNews this morning to talk about the latest news out of North Korea. #Sayfie #FlaPol https://t.co/Sd3h2F5eX8
2017-09-01 13:44:35,19,14,Groups tied to Hamas or Muslim Brotherhood should be ineligible for funding. It's a slap in the face of taxpayers. https://t.co/9UvqZigWXR
2017-04-30 20:12:11,18,8,.@RosLehtinen has been a phenomenal congresswoman and a fearless freedom fighter on behalf of the oppressed. Fair winds and following seas!
2016-12-23 19:49:27,126,64,Shame on President Obama and John Kerry for allowing anti-Israel resolution.  Should have stood against the UN mob and vetoed! #Israel
2016-12-16 00:33:35,22,13,Great statement: Ambassador to Israel nominee David Friedman pledges to work from our embassy in Jerusalem! https://t.co/3b3QTGERbu
2016-11-26 16:04:01,17,14,Those thousands of watery graves represent an unequivocal verdict on Fidel Castro: he was an evil man who brought misery to millions 13/
2016-11-26 16:03:28,10,6,"Why would they do this if Castro's Cuba was marked by ""social progress"" and ""egalitarian ideals"" as the media claims? 12/"
2016-11-26 16:03:07,8,9,They were likely to die in shark infested waters but Castro was so intolerable they were willing to risk violent death to escape 11/
2016-11-26 16:01:43,7,6,Perhaps the most tragic but clarifying proof of Castro's failed rule is the tens of thousands of Cubans who perished trying to flee 10/
2016-11-26 16:01:08,5,4,"Compare Cuban-Americans whose families fled Castro's tyranny: you see success at the highest levels in business, govt, sports etc 9/"
2016-11-26 16:00:47,5,4,The proof is in the pudding: Cuba is a failed state and has seen its standard of living plummet since Castro seized power 8/
2016-11-26 16:00:20,6,4,But the legacy of Fidel Castro is not complicated or mixed; he made Cuba a police state and his political program produced dismal results 7/
2016-11-26 15:59:58,4,3,"In a fawning obit, the NYT said Castro had a ""mixed record of social progress and abject poverty"" 6/"
2016-11-26 15:59:06,4,4,"The media seems confused by this: the LA Times called him a ""charismatic icon"" while the WSJ said he ""pursued egalitarian ideals"" 5/"
2016-11-26 15:58:38,9,7,"Castro wasn't a ""leader"" who ""served"" Cuba; he was a tyrant that ruled over Cubans by fiat 4/"
2016-11-26 15:58:05,10,6,"Castro jailed political opponents, confiscated private property and ruined the lives of millions 3/"
2016-11-26 15:57:33,7,9,"The hallmark of Castro's rule was repression of basic God-given rights such as the rights to speech, assembly, and worship 2/"
2016-11-26 15:56:38,10,6,Fidel Castro was a brutal dictator who turned the island nation of Cuba into a prison 1/
2016-11-11 16:30:17,12,2,I am honored to have served this great country and proud of the men and women who answered the call to serve. Happy… https://t.co/bf7UVZkIEC
2016-11-09 15:17:35,18,8,Proud to continue serving #CD6! Together we will work to make America stronger &amp; brighter for future generations. https://t.co/ZPfeqWTuGp
2016-11-09 02:18:02,36,20,"Thank you Flagler, Lake, St. Johns &amp; Volusia! I'll continue to defend taxpayers, hold DC accountable, &amp; work to exp… https://t.co/op22V0rZfK"
2016-11-08 13:38:04,13,6,"I'll defend taxpayers, fight to expand economic opportunity &amp; insist that Congress live under the same rules as eve… https://t.co/9NP85wfuMr"
2016-11-05 17:16:28,8,7,"Today is the last day to early vote! This election is too important, get out and early vote! Find voting location:… https://t.co/HXvP1AvPOz"
2016-11-02 17:38:56,6,5,In uncertain times we need proven leaders. Get out and early vote today! Find your voting location here:… https://t.co/k4s2mQ2GOB
2016-11-01 23:35:01,14,8,"Despite the Sate Dept's efforts to squash the investigation into the Clinton Foundation, it will rightly continue: https://t.co/iESb7Z8sgn"
