date,favorite_count,retweet_count,text
2018-09-09 19:32:00,329,150,"Taxpayers deserve protection: if the legislature wants to raise your taxes, it should require a supermajority to do… https://t.co/hUa4itG2Mi"
2018-09-09 17:14:18,362,147,"As the Jewish holiday of Rosh Hashanah begins this evening, I would like to wish Shanah Tova to all of our Jewish f… https://t.co/XoOVTG2XLU"
2018-09-09 16:08:00,1490,581,"I will fight for Florida’s great education programs, like the tax credit scholarship, that help some of the poorest… https://t.co/zXfDBY3ttY"
2018-09-09 15:58:22,203,108,Join us tomorrow in Miami! RSVP here: https://t.co/uRx6XjlQFH https://t.co/j8tJqYqvZG
2018-09-09 13:30:42,776,340,"Join @RepJNunez and me tomorrow for our campaign rally in Miami! We’ll be at the Bay of Pigs Museum &amp; Library, door… https://t.co/ZzZAWyomqz"
2018-09-08 19:05:01,1522,545,"Florida needs to diversify its economy to grow record new jobs in manufacturing, technology and financial services."
2018-09-08 16:31:00,3772,1535,The proper role of a court is to apply the law and constitution as it's written - not to rewrite it. I’ll only appo… https://t.co/P1XwZoeXOq
2018-09-08 14:00:01,3413,1183,"As Governor, I will leverage Florida’s favorable tax climate to attract investment in a wider array of industries,… https://t.co/xfQ6b97fjQ"
2018-09-08 13:20:05,568,158,My running mate @RepJNunez and I will be on @TeamCavuto at 10:15am. Tune in to @FoxNews!
2018-09-07 20:36:00,7119,2794,"I want to keep Florida a low tax state. Florida needs a governor who will cut taxes, not raise them by billions of dollars."
2018-09-07 20:01:15,647,355,"The U.S. added 201,000 jobs in August! Our economy is booming &amp; we’re seeing the real benefits of conservative econ… https://t.co/nCA8LazEtm"
2018-09-07 16:42:00,1997,708,"Our waterways are being polluted, and we’ve got to take a stand. On day one as your Governor, I will fight to stop… https://t.co/dxzDS1u9XF"
2018-09-07 13:02:00,2824,915,"I want to make sure that Florida parents, regardless of circumstances, have the opportunity to give their children a good education."
2018-09-07 00:44:37,2775,1229,"Together we will build on our economic success, protect our environment and empower parents to make the best educat… https://t.co/dB91PpO4s7"
2018-09-06 16:27:17,0,888,"RT @mike_pence: Thank you, @RonDeSantisFL &amp; @RepJNunez for the warm welcome in Orlando. The @GOP is uniting around DeSantis- a veteran &amp; co…"
2018-09-06 16:12:59,1904,678,"Honored to welcome Vice President Mike Pence to Orlando with @RepJNunez. Together, we will secure Florida’s future! https://t.co/Oq5U2V9uPv"
2018-09-06 13:49:57,383,171,".@RepJNunez will help us build on our economic success, protect our environment and empower parents to make the bes… https://t.co/mUTLyGaABe"
2018-09-06 13:49:56,878,420,".@RepJNunez is a strong, principled leader who will be an outstanding Lieutenant Governor for the people of Florida… https://t.co/T0egRmaHXV"
2018-09-06 12:15:00,4236,1491,"I believe that we should keep cutting taxes and put more money in the pockets of Floridians. It’s your money, not the government’s."
2018-09-05 20:01:00,2187,877,Good jobs.  Better education. Protecting our environment and natural resources. Fighting illegal immigration.  Fixi… https://t.co/CPrVXO80nS
2018-09-05 18:32:00,6330,1939,We need to get rid of common core and ensure that every child has access to a great education in Florida.
2018-09-05 13:00:01,7786,2294,I am committed to making Florida the worldwide destination for economic opportunity.
2018-09-04 20:43:59,1225,742,.@AndrewGillum can't explain how he would pay for his $33 TRILLION Medicare for All Plan without taking hard-earned… https://t.co/TK7up0Btso
2018-09-04 19:04:00,1699,624,"Water is our state’s most precious resource, and I am committed to keeping it clean.  The days of talking about the… https://t.co/ZLQW5mT9CK"
2018-09-04 16:15:00,9377,3117,I want to get vocational and technical and career training back into our high schools in a very big way.
2018-09-04 15:41:53,2093,1090,"Stand with me to continue Florida on its path to prosperity. I'll keep taxes low, reduce burdensome regulations and… https://t.co/87dtBOZQ1h"
2018-09-04 12:28:50,3961,1474,"In Florida, our economy is on a roll thanks to low tax policies. We need to build on that success—not destroy it with massive tax increases."
2018-09-03 19:01:20,4536,1942,Help make a difference in this campaign! Every bit of support I receive has a direct impact on our ability to promo… https://t.co/Pzxck434Td
2018-09-03 14:19:05,1746,658,Grateful for Florida's hard-working men and women who are growing our economy. Florida has the lowest unemployment… https://t.co/6PTEIL2Z56
2018-09-01 16:55:51,5326,1402,"Thank you for your support, your votes, your committment to our cause that helped us win BIG on election night! Now… https://t.co/zJEwF2TBRt"
2018-08-31 14:01:21,5940,4454,Socialist policies have failed time and time again. What’s frightening is that far-left liberals like @AndrewGillum… https://t.co/yIpB3FRj8Q
2018-08-30 20:46:54,3776,2186,".@AndrewGillum wants to abolish ICE, even as they crack down on sex trafficking in Florida. This is NOT the leaders… https://t.co/IKxFES8cTe"
2018-08-30 15:32:17,1631,934,.@AndrewGillum wants to fund his liberal tax-and-spend agenda on the backs of hard-working Florida families. His ta… https://t.co/ZibY5JVjoW
2018-08-29 16:30:42,6470,4044,".@AndrewGillum wants to take us back to higher taxes, fewer jobs, and less educational opportunities for our kids.… https://t.co/TONC2Q1Ng2"
2018-08-29 05:40:08,0,18606,RT @realDonaldTrump: Such a fantastic win for Ron DeSantis and the people of the Great State of Florida. Ron will be a fantastic Governor.…
2018-08-29 05:22:51,0,1032,"RT @FoxNews: .@RepDeSantis on @AndrewGillum: ""I'm trying to make Florida even better, he's trying to make Florida Venezuela."" @IngrahamAngl…"
2018-08-29 02:20:04,1077,399,.@michaelgwaltz is a decorated veteran and American patriot.  He is a strong conservative and will be a leader in C… https://t.co/T4Vqrnzm8M
2018-08-29 00:56:35,15008,3454,Thanks to all of the great volunteers and supporters across our state who helped us win tonight!
2018-08-29 00:08:43,29614,8531,"Thank you, Florida! https://t.co/4d2lhdzDEq"
2018-08-28 21:58:56,1745,593,Polls are closing soon! We have traveled the Sunshine State and met so many great people dedicated to securing Flor… https://t.co/ogQim2xFTD
2018-08-28 19:00:22,611,242,"We’re just a few hours away from our Election Night Party! Tonight, beginning at 6 pm, join us for our celebration… https://t.co/eT3VTZu2Ze"
2018-08-28 16:00:19,1070,415,Go vote and make sure your voice is heard. As an Iraq veteran and proven conservative endorsed by President… https://t.co/rYCwKfYX0p
2018-08-28 15:25:12,933,467,It’s Primary Election Day! Make sure you get out and vote for the ONLY candidate for Governor endorsed by President… https://t.co/30iKw4oe7D
2018-08-28 10:56:07,3088,1307,It's ELECTION DAY and your last chance to VOTE in the Republican primary! Let's bring home a big WIN and secure Flo… https://t.co/l2gfA9qWcU
2018-08-28 02:15:53,771,258,Thanks to all the great people in Daytona Beach who came out to our very last campaign stop before Election Day. We… https://t.co/PwrbXAUROW
2018-08-28 01:30:31,0,19362,RT @realDonaldTrump: VOTE FOR RON! https://t.co/80NShvQ73u
2018-08-28 00:08:03,631,288,Palm Beach County is DeSantis country! Great to be with so many committed conservatives heading into Election Day t… https://t.co/QcUnfh4mrt
2018-08-27 22:15:14,0,2889,RT @RonDeSantisFL: Tomorrow is ELECTION DAY and your last chance to VOTE in the Republican primary! Let's bring home a big WIN and secure F…
2018-08-27 21:21:34,902,278,Packed house here at @VersaillesMiami to see Ron DeSantis! https://t.co/jPm1oApKtV
2018-08-27 19:11:55,428,193,Folks here in Fort Myers are fired up to vote for Ron DeSantis! They know he’s standing up to the special interests… https://t.co/8SwzQRs84C
2018-08-27 17:31:47,2108,648,"@realDonaldTrump Thank you, Mr. President, for your continued support! Looking forward to a BIG win tomorrow!"
2018-08-27 17:21:48,0,18974,RT @realDonaldTrump: Congressman Ron DeSantis is a special person who has done an incredible job. He is running in Tuesdays Primary for Gov…
2018-08-27 16:01:10,165,58,It’s great to be back in Pinellas County where I grew up. Thanks to all the folks who came out to Palm Harbor to ra… https://t.co/Ojphi7ntyv
2018-08-27 15:26:22,5065,2889,Tomorrow is ELECTION DAY and your last chance to VOTE in the Republican primary! Let's bring home a big WIN and sec… https://t.co/IMNKSlWdbF
2018-08-26 15:23:21,356,200,"The Republican Primary is this Tuesday! Many counties are still early voting today, but this will be the LAST DAY.… https://t.co/ZixiksfmV6"
2018-08-25 17:55:15,410,219,The Republican Primary is this Tuesday! Don't forget to return your vote-by-mail ballot or VOTE EARLY at the polls.… https://t.co/QZEGm5dCTX
2018-08-24 23:59:17,449,201,"Today, I had the chance to tour the Caloosahatchee River, which has been devastated by toxic algae. As your Governo… https://t.co/oqx3V2k3mb"
2018-08-24 17:34:15,310,160,We will be touring the state this Monday to encourage everyone to get out the vote! Check out our list of stops and… https://t.co/UdZsW34Q1u
2018-08-24 15:30:00,148,75,"Join us this Tuesday, August 28th, to celebrate Election Night! We will be in Orlando at the Rosen Shingle Creek. R… https://t.co/TQYGuZO8l5"
2018-08-23 20:21:35,215,132,"Join us at one of our stops on our big Turnout Tour this Monday, August 27th to help us get across the finish line… https://t.co/TQ8r6Z3OKl"
2018-08-23 00:44:24,0,252,"RT @RonDeSantisFL: From Pensacola to Key West, and all across our state, we’ve seen a surge of support from great people who care deeply ab…"
2018-08-22 23:02:52,0,140,RT @ACUConservative: ICYMI ACU Endorses @RonDeSantisFL (ACUF lifetime rating 99%). Learn more here:
2018-08-22 16:53:10,595,252,"From Pensacola to Key West, and all across our state, we’ve seen a surge of support from great people who care deep… https://t.co/EY3DuIdilp"
2018-08-22 12:34:43,0,913,"RT @RonDeSantisFL: Tonight, @POTUS said that that I am a great candidate, and I’m proud to have his full and total endorsement to be your n…"
2018-08-22 00:18:34,2531,913,"Tonight, @POTUS said that that I am a great candidate, and I’m proud to have his full and total endorsement to be y… https://t.co/MVfcGcGYPb"
2018-08-21 21:22:11,184,83,"Join me and Team DeSantis for our big election night party at the Rosen Shingle Creek in Orlando this Tuesday, Augu… https://t.co/8JBlfh6f3O"
2018-08-21 18:27:08,187,71,"Yesterday, I was joined by Treasure Coast residents, business owners and clean water activists to tour the algae th… https://t.co/rp8XsyTOVe"
2018-08-20 18:53:29,380,224,Help us secure Florida's future! Find your early voting location: https://t.co/S7GPAKh1bv https://t.co/g1Wj4hHeAG
2018-08-20 17:43:32,481,136,Great to welcome LBA Academy students back to school! Charter schools give students more opportunities to succeed r… https://t.co/idECrtcTz0
2018-08-19 22:43:47,350,152,Great to join the Federated Republican Women of North Dade! These amazing @FloridaGOPWomen are fighting hard to ele… https://t.co/Pyd30czOxS
2018-08-19 19:14:39,0,82,RT @mattgaetz: #FreedomTour #DesantisRising #CrowdsEnergyMatters #TeamTrump @RonDeSantisFL @Jim_Jordan (@adamputnam #pleaseclap) #sayfie ht…
2018-08-19 14:07:48,356,164,Thanks to all of the patriots in Northwest Florida who joined us on the Freedom Tour yesterday! Early voting is goi… https://t.co/uwiLoitXWd
2018-08-18 19:58:47,387,213,Early voting for the August 28th Republican Primary is happening statewide! A vote for me--Ron DeSantis--is a vote… https://t.co/mjwltSPI3J
2018-08-18 19:14:12,124,47,Thank you to @Jenniffer2012 and all of the great people of Puerto Rico for your hospitality. While the island still… https://t.co/Y5i7vAgmH2
2018-08-18 17:42:10,0,921,RT @mattgaetz: With @RonDeSantisFL and @Jim_Jordan in Pensacola! Special thanks to Bikers for Trump https://t.co/LxdUU2PrPl
2018-08-17 21:05:00,163,67,"Our neighbors in Puerto Rico were hit hard by Hurricane Maria. Bit by bit, they are recovering. It was great to be… https://t.co/7rJH91FUlB"
2018-08-17 18:58:05,607,297,"President @RealDonaldTrump has thrown his support behind me because I'm ""strong on Borders, tough on Crime &amp; big on… https://t.co/UWnsmDVkGx"
2018-08-16 17:47:30,165,69,"Today, I joined scientists from FAU and FIT, local business, and community leaders to hear from them about the futu… https://t.co/lQdteH3DsE"
2018-08-16 12:20:31,0,128,RT @RonDeSantisFL: Thank you so much to @Capt4CleanWater and all the local residents in SW FL who came out today to take a stand for clean…
2018-08-16 01:25:48,312,128,Thank you so much to @Capt4CleanWater and all the local residents in SW FL who came out today to take a stand for c… https://t.co/Qu0IJhAWUh
2018-08-15 22:09:24,0,255,RT @TrumpGirlStrong: Thank you @RonDeSantisFL for coming to Englewood Beach for a roundtable with local residents &amp; business owners to addr…
2018-08-15 15:26:29,116,59,Great to join @MiamiYRs last night! We discussed how socialism and communism have failed every country that attempt… https://t.co/I1AWKzDoYz
2018-08-15 14:38:28,465,196,Florida continues to thrive because of our conservative leaders making smart policy decisions. As your next Governo… https://t.co/lwMbwDE4LL
2018-08-14 20:00:46,387,170,We are only two weeks away from the primary election! I feel blessed to be able to travel this great state and conn… https://t.co/gusaZERN3U
2018-08-14 00:59:00,502,169,HUGE turnout at the Palm Beach Trump Club! https://t.co/mnePF2Mliw
2018-08-13 18:51:36,529,212,"Proud to have Puerto Rico Lt. Gov. @LuisRiveraMarin's endorsement. He's thrown his support behind me, saying I'm ""a… https://t.co/Vs7r0S8VqS"
2018-08-13 15:31:03,226,139,Early voting started in many counties across our state today! Check to find your early voting location here:… https://t.co/1pMi5bDyOj
2018-08-10 18:00:33,258,68,Great time at the Palm Beach LobsterFest with my little guy! https://t.co/DnyMmKaGLT
2018-08-10 02:12:27,0,320,RT @RonDeSantisFL: Enough is enough! Florida’s waterways are being ravaged by toxic algae and It’s time to take a stand for clean water. I…
2018-08-10 00:10:05,0,526,RT @PollackHunter: With the next Governor of Florida @RonDeSantisFL who has been working with us on making sure All children and teachers a…
2018-08-09 20:38:56,0,386,RT @AndrewPollackFL: Ron DeSantis @RepDeSantis knows what it will take to #fixit! I very much look forward to working with him to make scho…
2018-08-09 19:35:27,714,320,Enough is enough! Florida’s waterways are being ravaged by toxic algae and It’s time to take a stand for clean wate… https://t.co/SyHUTFLHRH
2018-08-09 14:21:24,0,453,RT @RonDeSantisFL: We have a historic opportunity in Florida to build on the economic success of Governor Rick Scott. Florida cannot afford…
2018-08-09 00:50:25,1384,453,We have a historic opportunity in Florida to build on the economic success of Governor Rick Scott. Florida cannot a… https://t.co/KL0lqvIVfb
2018-08-09 00:31:10,410,167,I refuse to sell out our water quality and natural resources to special interest groups! We cannot continue to send… https://t.co/h2cn4sBIba
2018-08-09 00:13:11,848,156,"As someone who served at Naval station Mayport down the road, I’m humbled to be here in Jacksonville laying out my… https://t.co/ms8CR6m71G"
2018-08-09 00:02:21,183,72,We are LIVE here in Jacksonville for the last GOP debate! Tune in now: https://t.co/wWZMWijgSw
2018-08-08 23:52:48,328,114,Supporters are excited and ready to see Ron DeSantis knock it out of the park tonight at the final GOP debate in Ja… https://t.co/LROKiWXs4P
2018-08-08 22:25:43,0,301,RT @mattgaetz: #TeamDesantis in Jacksonville and ready to keep #winning https://t.co/3clGUt6TJU
2018-08-08 19:19:33,225,110,Don’t miss the last debate before the Republican Primary! Live stream from @wjxt4 at 8 p.m. tonight! https://t.co/RCMThyCZgp
2018-08-07 15:39:44,908,342,I am eternally grateful to all in our armed forces who have been wounded or laid down their lives in the name of ou… https://t.co/VebMfiDDPW
2018-08-07 13:26:50,0,470,"RT @RonDeSantisFL: With the backing of President Trump, I'm fighting to secure Florida’s future through strong conservative policies—like b…"
2018-08-06 20:32:19,1172,470,"With the backing of President Trump, I'm fighting to secure Florida’s future through strong conservative policies—l… https://t.co/fGbfJ6pmxh"
2018-08-06 20:02:26,425,137,"Great to meet with the Republican Women of Miami Federated to discuss education reform, increasing economic opportu… https://t.co/VXq5XHvfPr"
2018-08-04 20:37:32,210,67,Great time speaking at the @FMAPAC Luncheon in Orlando. Thanks for having me! https://t.co/d2ZCGn36LX
2018-08-04 17:51:24,0,82,RT @FMAPAC: Congressman @RepDeSantis    updating Florida’s physicians on his platform for Governor. The @FMAPAC is proud to endorse @RonDeS…
2018-08-03 19:25:13,1196,339,"Proud to have the Big Man himself, President @realDonaldTrump, come to Tampa to endorse my run for governor of the… https://t.co/ECeh15KooP"
2018-08-03 12:18:41,0,731,"RT @RonDeSantisFL: We can improve our education system in Florida by stopping Common Core, empowering parents to make the best decision for…"
2018-08-03 00:07:59,3080,668,"Ready to bring down the house with .@DonaldJTrumpJr, .@mattgaetz, .@Scotttaylorva and @KyleKashuv in Niceville! https://t.co/TpQj1sF7Vq"
2018-08-02 22:43:23,2554,731,"We can improve our education system in Florida by stopping Common Core, empowering parents to make the best decisio… https://t.co/fTE03POHyo"
2018-08-01 23:36:09,0,813,RT @RonDeSantisFL: We can fight illegal immigration here in Florida by enacting E-Verify and stopping sanctuary cities! https://t.co/o921Bm…
2018-08-01 16:16:30,2061,813,We can fight illegal immigration here in Florida by enacting E-Verify and stopping sanctuary cities! https://t.co/o921BmMQJ4
2018-08-01 15:08:11,2334,684,I’m proud President @realDonaldTrump came to Florida last night to stand with me and all conservatives who are figh… https://t.co/qjdONUJ8J2
2018-08-01 02:12:14,0,824,"RT @RonDeSantisFL: For someone who grew up just across the bay, in Pinellas County, starting out working 6 bucks an hour, it’s a true honor…"
2018-08-01 01:56:10,0,1874,"RT @AndrewPollackFL: Thank you @LaraLeaTrump and @realDonaldTrump for asking me to lead the pledge of allegiance, and for giving my family…"
2018-07-31 23:56:12,749,325,The crowd is hearing from the Big Man himself—President Donald Trump! Ron DeSantis is the strong conservative candi… https://t.co/fswV5qrbrm
2018-07-31 23:48:07,638,305,Florida is going in the right direction. We need to continue our economic success and build upon it. We can’t go ba… https://t.co/Uv8DArnJe6
2018-07-31 23:47:23,0,2062,"RT @FoxNews: .@POTUS holds a ""Make America Great Again"" rally in Tampa, Florida. https://t.co/Z3dmqw65zV"
2018-07-31 23:40:32,3006,824,"For someone who grew up just across the bay, in Pinellas County, starting out working 6 bucks an hour, it’s a true… https://t.co/rAn1TAQutA"
2018-07-31 23:32:54,136,62,@realDonaldTrump: “Everybody needs to support Ron DeSantis in our August 28th primary and in the November general e… https://t.co/9jUEtlKWt7
2018-07-31 23:21:03,0,428,"RT @FoxNews: .@RonDeSantisFL: ""We have the strongest economy we've had in years."" https://t.co/3X37eYTFgA"
2018-07-31 22:45:36,429,166,Casey DeSantis speaking to a HUGE crowd about why her husband is the best choice for securing Florida’s future! https://t.co/BtXC32o66G
2018-07-31 22:13:02,1074,372,It’s time—the rally is starting! Floridians from across the state have come to hear from President @realDonaldTrump… https://t.co/YiaFAnMiOA
2018-07-31 20:50:14,0,8408,"RT @realDonaldTrump: On my way to Tampa, Florida. Look forward to seeing everyone soon! https://t.co/BSB6IjBK7r"
2018-07-31 20:35:39,664,288,Big league event with the Big Man tonight– the kids are prepared! https://t.co/7JISwQmUjz
2018-07-31 20:06:00,1684,507,"In just a few hours, President @realDonaldTrump will be on stage with me in Tampa to let Floridians know why I’m th… https://t.co/IVrONrImJ9"
2018-07-31 14:19:37,1315,513,TONIGHT’S THE NIGHT! President @realDonaldTrump will be joining me in Tampa for a YUGE rally! Get your tickets NOW… https://t.co/yLYctJHR0w
2018-07-31 12:23:09,0,13356,"RT @realDonaldTrump: Will be in Tampa tonight. A big year for @RepDeSantis, who will be a great governor for Florida. Strong on Crime, Bord…"
2018-07-31 01:43:58,601,191,Huge crowd here at The Villages tonight! Thank you to our grassroots supporters dedicated to securing Florida’s fut… https://t.co/GVx8l2jWXj
2018-07-30 23:51:27,0,80,"RT @Talkmaster: Hey @adamputnam !  Why don't you add  the word ""liar"" to your Twitter bio?  It belongs there."
2018-07-30 23:51:22,0,194,RT @Talkmaster: In Florida Adam Putnam continues lying through his teeth about Ron DeSantis and the FairTax.  Shameless. @adamputnam
2018-07-30 23:46:51,1052,457,President @realDonaldTrump will be in Tampa tomorrow to support my run for Governor and I hope you can join us! Get… https://t.co/dSiKQox66w
2018-07-30 22:40:08,0,2801,"RT @RonDeSantisFL: Listen to my wife Casey, she’s always right. https://t.co/lGcOHc8wEK"
2018-07-30 17:33:38,6468,2801,"Listen to my wife Casey, she’s always right. https://t.co/lGcOHc8wEK"
2018-07-28 20:04:28,414,142,Great to be in Sarasota with those dedicated to securing Florida’s future and supporting @realdonaldtrump. Hope to… https://t.co/KWs22YEqWU
2018-07-28 20:00:27,178,76,"Proud to stand with @cfcoalitionfl for faith, family, freedom, and the right to life. https://t.co/oGnwDLdsHh"
2018-07-28 14:09:18,0,213,"RT @RonDeSantisFL: Raise ‘em Right! Get your yard sign, today! https://t.co/rSvWb1V6Dk https://t.co/qzrl15s7Sm"
2018-07-28 01:58:21,0,14981,"RT @realDonaldTrump: Join me in Tampa, Florida next Tuesday, July 31st at 7:00pmE for a #MAGA Rally! Tickets: https://t.co/Q2PMyTACl8 https…"
2018-07-27 23:16:33,610,213,"Raise ‘em Right! Get your yard sign, today! https://t.co/rSvWb1V6Dk https://t.co/qzrl15s7Sm"
2018-07-27 19:36:19,489,240,I’m proud to be endorsed by the @ACUConservative. I’ve led the charge in Congress to ensure our conservative princi… https://t.co/FSXarZt3M8
2018-07-27 18:20:14,202,75,Great to join the Solivita community in Central Florida today and receive the endorsement of @MSchlapp and… https://t.co/OFsJuzxQwv
2018-07-27 17:44:26,0,48,"RT @ACUConservative: Stressing his strong conservative record, ACU Chairman @mschlapp in Florida to endorse @rondesantisFl for #FLGov! http…"
2018-07-26 21:21:27,0,119,RT @Talkmaster: Read this.  The Adam Putnam campaign is LYING THROUGH ITS TEETH ... and they know it.  Now so do you.  https://t.co/APUviBE…
2018-07-26 17:30:19,0,31,RT @Talkmaster: @adamputnam If you are having trouble understanding the FairTax perhaps you ought to contact me.  I wrote the book.
2018-07-25 20:30:00,0,994,"RT @RonDeSantisFL: SOCIALISM DOESN’T WORK. It’s never worked. In Florida, we’re rejecting the policies that are causing starvation in Venez…"
2018-07-25 15:47:01,4263,994,"SOCIALISM DOESN’T WORK. It’s never worked. In Florida, we’re rejecting the policies that are causing starvation in… https://t.co/TIKlTk1Wz4"
2018-07-24 20:22:13,0,305,RT @RonDeSantisFL: 🚨TRUMP RALLY IN TAMPA next week on July 31st to support our campaign for Governor! Sign up now: https://t.co/mxGZu1Cwum
2018-07-24 12:55:28,556,305,🚨TRUMP RALLY IN TAMPA next week on July 31st to support our campaign for Governor! Sign up now: https://t.co/mxGZu1Cwum
2018-07-23 22:15:33,1071,267,Trust me: socialism wrapped in ignorance is something Floridians from all walks of life reject.
2018-07-23 22:15:32,2574,870,"My problem is not with your identity but with your unhinged socialist views.  

Socialism doesn't work, Israel isn'… https://t.co/iY3KeaQ1Mr"
2018-07-23 00:56:18,0,1176,RT @RonDeSantisFL: Breitbart: DeSantis Rising: Florida Congressman Now the Sunshine State GOP Gubernatorial Frontrunner. Thank you ⁦⁦@realD…
2018-07-22 19:22:29,3569,1176,Breitbart: DeSantis Rising: Florida Congressman Now the Sunshine State GOP Gubernatorial Frontrunner. Thank you ⁦⁦… https://t.co/0PwnwLBECI
2018-07-21 23:44:18,1488,414,"Our little guy, Mason, met with supporters in Jacksonville and joined me at the studio! He says, vote for Dad! https://t.co/Q0M1WkCDB8"
2018-07-21 20:11:59,382,128,North Florida knows we need a strong conservative governor - thank you to all who joined me today in Orange Park! https://t.co/67cPoq6OPc
2018-07-21 13:57:30,197,55,Great way to start the morning at The Local in Jacksonville with supporters. Thanks to everyone that came out! https://t.co/V7JIc8KH3K
2018-07-21 12:22:29,207,63,Visiting The Local in Jacksonville this morning to meet with supporters and then headed to Orange Park for a Clay C… https://t.co/j8VKvbvsEt
2018-07-19 21:09:00,0,1311,"RT @RonDeSantisFL: Incredibly thankful for the Trump Family, @DonaldJTrumpJr, and our supporters. Let’s secure Florida’s future! https://t.…"
2018-07-18 21:15:32,0,146,RT @mattgaetz: Today @RonDeSantisFL held a rocking rally with @DonaldJTrumpJr! I don’t know what that #LowEnergy @adamputnam thing is #Sayf…
2018-07-18 19:51:01,5034,1311,"Incredibly thankful for the Trump Family, @DonaldJTrumpJr, and our supporters. Let’s secure Florida’s future! https://t.co/Nuhtl2te8E"
