date,favorite_count,retweet_count,text
2016-11-01 20:30:03,1,2,Only 7 days until election day! Have you early voted yet? Find your voting location here: https://t.co/EdIrYsslQD
2016-11-01 20:14:07,4,13,Pay-to-play? @HillaryClinton's two official favors to Morocco resulted in $28 million for Clinton Foundation. https://t.co/mL4Cew6jad
2016-10-31 23:07:18,0,1238,"RT @LouDobbs: Corrupt Clinton Cartel starting to sweat: FBI investigates 650,000 more emails!!! @RepDeSantis joins #FoxLDT 7pm"
2016-10-31 14:18:27,2,1,"Have you early voted yet? If you haven't, vote today! This election is too important. Find voting location:… https://t.co/LezpIek75j"
2016-10-29 15:41:17,5,4,Forbes ranked Deltona one of the top 10 best cities for future job growth! https://t.co/ZXN3tq0Z0F #sayfie #flapol
2016-10-28 19:51:00,87,128,I am alarmed Obama's appointed U.S. AG is stonewalling to protect the President regarding Iran ransom payments. https://t.co/SAdzaFtipa
2016-10-28 19:38:03,5,3,FBI to re-open investigation into  @HillaryClinton's server. Perhaps this time she will be held accountable. https://t.co/ZucUN7dEKL
2016-10-27 15:19:14,12,10,"Every day 22 veterans commit suicide, because the VA is failing our heroes. We must pass the #PAWSAct to help those… https://t.co/T5mRdkqQK1"
2016-10-26 19:55:09,4,3,Get Out and Vote! Early Voting started this week. Find a location near you: https://t.co/4IU4yVW4Nd #sayfie… https://t.co/jneC0XbmKx
2016-10-25 14:07:13,3,4,Obamacare premiums will rise by double-digit percentages in 2017 as the quality of health care continues to plummet… https://t.co/W4DU2TzZE9
2016-10-13 16:50:02,19,8,Proud to have served in the Navy &amp; currently in the reserves. Thank you to the hardworking brave men &amp; women who an… https://t.co/gAfLav8He2
2016-10-05 21:20:58,5,2,We must take precautions &amp; be prepared for #Matthew. You can build your emergency plan here:… https://t.co/E4veBXIQl0
2016-09-26 01:22:58,11,8,"RIP to The King, Arnold Palmer, a terrific golfer, class act and great American. Hope we see a lot of ice tea/lemonade toasts in his honor."
2016-09-20 19:04:10,4,4,.@HillaryClinton’s IT guy may have asked Reddit for help altering emails after subpoena was issued: https://t.co/5LfEVUsPXv #sayfie
2016-09-15 00:47:30,0,40,"RT @FoxNewsInsider: .@RepDeSantis: House Hearing on Emails Was 'Devastating' for Hillary, FBI @AmericaNewsroom https://t.co/qzbwG9u8b8 http…"
2016-09-14 13:34:02,13,10,Thankful for our hardworking volunteers in Ormond Beach that are helping spread the message of liberty &amp; freedom! https://t.co/NvJsRPtp5S
2016-09-13 23:28:38,6,5,".@TeamCavuto &amp; I discuss the 9/11 victims' bill that Obama plans to veto, despite having overwhelming support: https://t.co/vEDtnDeRDt"
2016-09-13 13:05:02,11,12,"Hillary calls her opposition a ""basket of deplorables."" Does that include military personnel opposing her? https://t.co/rDTNg4twWv"
2016-09-11 18:22:39,8,3,We will #NeverForget the lives lost on 9/11. We must honor them by defending freedom &amp; standing up to terror. https://t.co/Xlw7jeiTK3
2016-09-09 17:08:18,16,21,"If @HillaryClinton really cared about the Zika virus, she’d tell @TimKaine to stop blocking funding &amp; missing votes! https://t.co/JAZrtIG9Xy"
2016-09-05 15:40:26,6,3,Happy #LaborDay! https://t.co/WJAfENnIg3
2016-08-31 23:10:30,4,1,I'll be joining @DavidAsmanfox on @FoxBusiness tonight at 7:35pm to discuss the Clinton Foundation. #sayfie #flapol
